題目,答案,選項1,選項2,選項3,選項4,答對回饋,答錯回饋
"淡江大學教育科技學系隸屬於哪一個學院？",(C) 教育學院,(A) 文學院,(B) 工學院,(C) 教育學院, (D) 商管學院,"算你厲害！","就你這實力還想贏過我?。"
"在教育科技領域中，常用的 ADDIE 教學設計模型，其中的「D」代表哪個階段？",(B) 設計 (Design),(A) 診斷 (Diagnosis),(B) 設計 (Design), (C) 傳播 (Distribution),(D) 數位化 (Digitalization),"嗯...完全正確！去尋找小露並獲得最終獎勵吧","就你這實力還想贏過我?。"
"淡江教科系的課程發展主要圍繞在哪兩大核心領域？",(C)教學設計與數位媒體,(A) 硬體維修與網路工程,(B) 幼兒教育與特教理論,(C) 教學設計與數位媒體 ,(D) 企業管理與會計審計,"沒錯呢，快去尋找小露並獲得最終獎勵吧","這個答案不對啊。","嗯 不是這個答案。"
"下列何者是淡江教科系畢業生在企業界中，最常見且具備競爭力的職位？",(A)數位學習規劃師 (Instructional Designer),(A) 數位學習規劃師 (Instructional Designer), (B) 土木結構技師,(C) 臨床心理醫生,(D) 金融分析師,"可惡被你答對了，尋找小露並獲得最終獎勵吧","就你這實力還想贏過我?。"
"淡江教科系每年的大四學生會透過哪種方式來統整並展示四年所學？",(C)畢業專題製作與成果展,"(A) 參加全國馬拉松",(B) 撰寫純文學小說,(C) 畢業專題製作與成果展, (D) 舉辦鋼琴演奏會,"完美!","嗯 不是這個答案。"